{
  "run_id": "2026-09-01T13-07-59-563Z",
  "weighted_score": 23103.2,
  "status": "success",
  "app_url": "http://localhost:3000",
  "start_command": "npm --prefix '../../../output/app' run dev",
  "summary": "Shelf Keeper: Track your personal book collection and who has borrowed what, so you always know where your books are.",
  "implemented_features": [
    "Add a book to the collection",
    "Edit or remove a book",
    "Lend a book to someone",
    "Return a borrowed book",
    "View all books in one list",
    "Filter to books currently lent out",
    "See how many books are lent out"
  ],
  "assumptions": [
    "Built for A single user managing their home library on their own computer..",
    "Persistence decision: Browser localStorage with malformed-data recovery; single key holding the Book array."
  ],
  "tests_run": [
    {
      "command": "npm test",
      "journey": "Generated journey suite passed: add-book: domain helper creates a book record correctly; UI smoke shows list after render; lend-book: isLent returns true after lend; countLent increments; return-book: isLent returns false after returnBook; countLent decrements; filter-lent: filterLent returns only books with non-empty borrower; lent-count: countLent returns correct number for mixed collection",
      "result": "passed"
    }
  ],
  "harness_checks": [
    {
      "command": "output/app/node_modules/.bin/vitest run --reporter=json --outputFile=artifacts/runs/2026-09-01T13-07-59-563Z/verification/attempt-00/app-test-results.json --passWithNoTests=false",
      "journey": "The generated app's Vitest report contained at least one completed test and no failed, skipped, or todo tests",
      "result": "passed"
    },
    {
      "command": "npm run build",
      "journey": "The generated app completed a production build",
      "result": "passed"
    },
    {
      "command": "npm run dev",
      "journey": "The generated app started its own HTTP server on port 3000 and shut down cleanly",
      "result": "passed"
    }
  ],
  "model_calls": 4,
  "input_tokens": 5784,
  "output_tokens": 5404,
  "cache_read_tokens": 11072,
  "cache_write_tokens": 0,
  "total_tokens": 22260,
  "reasoning_tokens": 0,
  "cost_total": 0,
  "call_log": [
    {
      "index": 1,
      "model": "berget/zai-org/GLM-5.2",
      "input_tokens": 2074,
      "output_tokens": 1331,
      "cache_read_tokens": 0,
      "cache_write_tokens": 0,
      "total_tokens": 3405,
      "reasoning_tokens": 0,
      "cost_total": 0
    },
    {
      "index": 2,
      "model": "berget/zai-org/GLM-5.2",
      "input_tokens": 25,
      "output_tokens": 4,
      "cache_read_tokens": 3392,
      "cache_write_tokens": 0,
      "total_tokens": 3421,
      "reasoning_tokens": 0,
      "cost_total": 0
    },
    {
      "index": 3,
      "model": "berget/zai-org/GLM-5.2",
      "input_tokens": 3621,
      "output_tokens": 4066,
      "cache_read_tokens": 0,
      "cache_write_tokens": 0,
      "total_tokens": 7687,
      "reasoning_tokens": 0,
      "cost_total": 0
    },
    {
      "index": 4,
      "model": "berget/zai-org/GLM-5.2",
      "input_tokens": 64,
      "output_tokens": 3,
      "cache_read_tokens": 7680,
      "cache_write_tokens": 0,
      "total_tokens": 7747,
      "reasoning_tokens": 0,
      "cost_total": 0
    }
  ],
  "pi_exit_code": 0,
  "telemetry_source": "pi-json-event-stream",
  "port_reclamation": {
    "preexisting_listener": false,
    "listener_after_pi": false,
    "attempted": false,
    "reclaimed": false,
    "process_ids": [],
    "diagnostic": "Port 3000 remained free after Pi"
  }
}
