{
  "run_id": "2026-08-23T15-34-35-544Z",
  "weighted_score": 29400.6,
  "status": "success",
  "app_url": "http://localhost:3000",
  "start_command": "npm --prefix '../../../output/phase-isolated-public' run dev",
  "summary": "Shelfkeeper: A simple personal book lending tracker for one person's home library — catalogue books, mark who borrowed what, and see at a glance what's currently out.",
  "implemented_features": [
    "Catalogue a new book",
    "Fix or remove a wrongly entered book",
    "Lend a book and get it back",
    "See everything I own in one list",
    "Filter to just the lent-out books",
    "See how many are lent out right now",
    "Survive a browser refresh"
  ],
  "assumptions": [
    "Built for A single user (the bookshelf owner) on their own computer, keeping track of family book borrowing..",
    "Persistence decision: Browser localStorage with a single JSON array of Book objects under the key 'shelfkeeper.books'."
  ],
  "tests_run": [
    {
      "command": "npm test",
      "journey": "Generated journey suite passed: Add a book, confirm it appears in the list, refresh and confirm it persists; Lend a book, confirm lent count increments and filter shows it, return it, confirm count decrements and filter hides it; Edit a book's title and category, confirm changes persist after refresh; Delete a book, confirm it is gone from the list and count updates; Load with malformed localStorage JSON, confirm app does not crash and starts with empty list",
      "result": "passed"
    }
  ],
  "harness_checks": [
    {
      "command": "output/phase-isolated-public/node_modules/.bin/vitest run --reporter=json --outputFile=artifacts/runs/2026-08-23T15-34-35-544Z/verification/attempt-00/app-test-results.json --passWithNoTests=false",
      "journey": "The generated app's Vitest report contained at least one completed test and no failed, skipped, or todo tests",
      "result": "passed"
    },
    {
      "command": "npm run build",
      "journey": "The generated app completed a production build",
      "result": "passed"
    },
    {
      "command": "npm run dev",
      "journey": "The generated app started its own HTTP server on port 3000 and shut down cleanly",
      "result": "passed"
    }
  ],
  "model_calls": 4,
  "input_tokens": 2909,
  "output_tokens": 8374,
  "cache_read_tokens": 13696,
  "cache_write_tokens": 0,
  "total_tokens": 24979,
  "reasoning_tokens": 0,
  "cost_total": 0.019657,
  "call_log": [
    {
      "index": 1,
      "model": "berget/zai-org/GLM-5.2",
      "input_tokens": 649,
      "output_tokens": 1388,
      "cache_read_tokens": 1344,
      "cache_write_tokens": 0,
      "total_tokens": 3381,
      "reasoning_tokens": 0,
      "cost_total": 0.0034249999999999997
    },
    {
      "index": 2,
      "model": "berget/zai-org/GLM-5.2",
      "input_tokens": 65,
      "output_tokens": 4,
      "cache_read_tokens": 3328,
      "cache_write_tokens": 0,
      "total_tokens": 3397,
      "reasoning_tokens": 0,
      "cost_total": 0.000073
    },
    {
      "index": 3,
      "model": "berget/zai-org/GLM-5.2",
      "input_tokens": 2090,
      "output_tokens": 6979,
      "cache_read_tokens": 0,
      "cache_write_tokens": 0,
      "total_tokens": 9069,
      "reasoning_tokens": 0,
      "cost_total": 0.016048
    },
    {
      "index": 4,
      "model": "berget/zai-org/GLM-5.2",
      "input_tokens": 105,
      "output_tokens": 3,
      "cache_read_tokens": 9024,
      "cache_write_tokens": 0,
      "total_tokens": 9132,
      "reasoning_tokens": 0,
      "cost_total": 0.00011099999999999999
    }
  ],
  "pi_exit_code": 0,
  "telemetry_source": "pi-json-event-stream",
  "port_reclamation": {
    "preexisting_listener": false,
    "listener_after_pi": false,
    "attempted": false,
    "reclaimed": false,
    "process_ids": [],
    "diagnostic": "Port 3000 remained free after Pi"
  }
}
