{
  "run_id": "2026-08-30T08-58-19-599Z",
  "weighted_score": 47707.6,
  "status": "partial",
  "app_url": "http://localhost:3000",
  "start_command": "npm --prefix '../../../output/fixrun-02' run dev",
  "summary": "Shelf Ledger: generation completed, but independent verification did not pass.",
  "implemented_features": [
    "Add a book to the collection",
    "Edit or remove a book",
    "Lend a book and mark it returned",
    "Filter to books currently lent out",
    "See how many books are lent out",
    "Data survives a browser refresh"
  ],
  "assumptions": [
    "Built for A single user managing their home book collection on their own computer..",
    "Persistence decision: Browser localStorage under key 'shelf-ledger-books'; load with malformed-data recovery (fall back to empty array on parse failure)."
  ],
  "tests_run": [
    {
      "command": "npm test",
      "journey": "Generated journey verification failed: Add a book, lend it to someone, verify lent count increments and filter shows it, then return it and verify count returns to zero. Failed checks: output/fixrun-02/node_modules/.bin/vitest run --reporter=json --outputFile=artifacts/runs/2026-08-30T08-58-19-599Z/verification/attempt-02/app-test-results.json --passWithNoTests=false",
      "result": "failed"
    }
  ],
  "harness_checks": [
    {
      "command": "output/fixrun-02/node_modules/.bin/vitest run --reporter=json --outputFile=artifacts/runs/2026-08-30T08-58-19-599Z/verification/attempt-02/app-test-results.json --passWithNoTests=false",
      "journey": "The generated app's Vitest report contained at least one completed test and no failed, skipped, or todo tests",
      "result": "failed"
    },
    {
      "command": "npm run build",
      "journey": "The generated app completed a production build",
      "result": "passed"
    },
    {
      "command": "npm run dev",
      "journey": "The generated app started its own HTTP server on port 3000 and shut down cleanly",
      "result": "passed"
    }
  ],
  "model_calls": 13,
  "input_tokens": 13795,
  "output_tokens": 9525,
  "cache_read_tokens": 53376,
  "cache_write_tokens": 0,
  "total_tokens": 76696,
  "reasoning_tokens": 0,
  "cost_total": 0,
  "call_log": [
    {
      "index": 1,
      "model": "berget/zai-org/GLM-5.2",
      "input_tokens": 222,
      "output_tokens": 1207,
      "cache_read_tokens": 1856,
      "cache_write_tokens": 0,
      "total_tokens": 3285,
      "reasoning_tokens": 0,
      "cost_total": 0
    },
    {
      "index": 2,
      "model": "berget/zai-org/GLM-5.2",
      "input_tokens": 33,
      "output_tokens": 4,
      "cache_read_tokens": 3264,
      "cache_write_tokens": 0,
      "total_tokens": 3301,
      "reasoning_tokens": 0,
      "cost_total": 0
    },
    {
      "index": 3,
      "model": "berget/zai-org/GLM-5.2",
      "input_tokens": 2096,
      "output_tokens": 4810,
      "cache_read_tokens": 576,
      "cache_write_tokens": 0,
      "total_tokens": 7482,
      "reasoning_tokens": 0,
      "cost_total": 0
    },
    {
      "index": 4,
      "model": "berget/zai-org/GLM-5.2",
      "input_tokens": 113,
      "output_tokens": 3,
      "cache_read_tokens": 7424,
      "cache_write_tokens": 0,
      "total_tokens": 7540,
      "reasoning_tokens": 0,
      "cost_total": 0
    },
    {
      "index": 5,
      "model": "berget/zai-org/GLM-5.2",
      "input_tokens": 2727,
      "output_tokens": 26,
      "cache_read_tokens": 1024,
      "cache_write_tokens": 0,
      "total_tokens": 3777,
      "reasoning_tokens": 0,
      "cost_total": 0
    },
    {
      "index": 6,
      "model": "berget/zai-org/GLM-5.2",
      "input_tokens": 596,
      "output_tokens": 14,
      "cache_read_tokens": 3776,
      "cache_write_tokens": 0,
      "total_tokens": 4386,
      "reasoning_tokens": 0,
      "cost_total": 0
    },
    {
      "index": 7,
      "model": "berget/zai-org/GLM-5.2",
      "input_tokens": 619,
      "output_tokens": 1250,
      "cache_read_tokens": 4352,
      "cache_write_tokens": 0,
      "total_tokens": 6221,
      "reasoning_tokens": 0,
      "cost_total": 0
    },
    {
      "index": 8,
      "model": "berget/zai-org/GLM-5.2",
      "input_tokens": 30,
      "output_tokens": 4,
      "cache_read_tokens": 6208,
      "cache_write_tokens": 0,
      "total_tokens": 6242,
      "reasoning_tokens": 0,
      "cost_total": 0
    },
    {
      "index": 9,
      "model": "berget/zai-org/GLM-5.2",
      "input_tokens": 2415,
      "output_tokens": 59,
      "cache_read_tokens": 1600,
      "cache_write_tokens": 0,
      "total_tokens": 4074,
      "reasoning_tokens": 0,
      "cost_total": 0
    },
    {
      "index": 10,
      "model": "berget/zai-org/GLM-5.2",
      "input_tokens": 4863,
      "output_tokens": 13,
      "cache_read_tokens": 4032,
      "cache_write_tokens": 0,
      "total_tokens": 8908,
      "reasoning_tokens": 0,
      "cost_total": 0
    },
    {
      "index": 11,
      "model": "berget/zai-org/GLM-5.2",
      "input_tokens": 25,
      "output_tokens": 1485,
      "cache_read_tokens": 8896,
      "cache_write_tokens": 0,
      "total_tokens": 10406,
      "reasoning_tokens": 0,
      "cost_total": 0
    },
    {
      "index": 12,
      "model": "berget/zai-org/GLM-5.2",
      "input_tokens": 56,
      "output_tokens": 650,
      "cache_read_tokens": 10368,
      "cache_write_tokens": 0,
      "total_tokens": 11074,
      "reasoning_tokens": 0,
      "cost_total": 0
    },
    {
      "index": 13,
      "model": "berget/zai-org/GLM-5.2",
      "input_tokens": 0,
      "output_tokens": 0,
      "cache_read_tokens": 0,
      "cache_write_tokens": 0,
      "total_tokens": 0,
      "cost_total": 0
    }
  ],
  "pi_exit_code": 0,
  "telemetry_source": "pi-json-event-stream",
  "port_reclamation": {
    "preexisting_listener": false,
    "listener_after_pi": false,
    "attempted": false,
    "reclaimed": false,
    "process_ids": [],
    "diagnostic": "Port 3000 remained free after Pi"
  }
}
