{
  "run_id": "2026-08-30T10-27-56-967Z",
  "weighted_score": 47290.4,
  "status": "success",
  "app_url": "http://localhost:3000",
  "start_command": "npm --prefix '../../../output/batch-05' run dev",
  "summary": "Shelf Ledger: A simple personal book tracker that remembers every book on your shelf and who currently has each one.",
  "implemented_features": [
    "Add a book to the collection",
    "Edit or remove a book",
    "Lend a book and mark it returned",
    "View all books in one list",
    "Filter to books currently lent out",
    "See how many books are lent out",
    "Data survives a browser refresh"
  ],
  "assumptions": [
    "Built for A single user managing their home book collection on their own computer..",
    "Persistence decision: Browser localStorage with JSON serialization and malformed-data recovery"
  ],
  "tests_run": [
    {
      "command": "npm test",
      "journey": "Generated journey suite passed: Add a book, lend it to someone, verify it appears in the lent filter and the count increments, then return it and verify count returns to zero; Edit a book's title and category and confirm the change persists in the list; Delete a book and confirm it no longer appears in the list or the lent count",
      "result": "passed"
    }
  ],
  "harness_checks": [
    {
      "command": "output/batch-05/node_modules/.bin/vitest run --reporter=json --outputFile=artifacts/runs/2026-08-30T10-27-56-967Z/verification/attempt-02/app-test-results.json --passWithNoTests=false",
      "journey": "The generated app's Vitest report contained at least one completed test and no failed, skipped, or todo tests",
      "result": "passed"
    },
    {
      "command": "npm run build",
      "journey": "The generated app completed a production build",
      "result": "passed"
    },
    {
      "command": "npm run dev",
      "journey": "The generated app started its own HTTP server on port 3000 and shut down cleanly",
      "result": "passed"
    }
  ],
  "model_calls": 14,
  "input_tokens": 13845,
  "output_tokens": 9109,
  "cache_read_tokens": 61184,
  "cache_write_tokens": 0,
  "total_tokens": 84138,
  "reasoning_tokens": 0,
  "cost_total": 0,
  "call_log": [
    {
      "index": 1,
      "model": "berget/zai-org/GLM-5.2",
      "input_tokens": 221,
      "output_tokens": 1210,
      "cache_read_tokens": 1856,
      "cache_write_tokens": 0,
      "total_tokens": 3287,
      "reasoning_tokens": 0,
      "cost_total": 0
    },
    {
      "index": 2,
      "model": "berget/zai-org/GLM-5.2",
      "input_tokens": 35,
      "output_tokens": 4,
      "cache_read_tokens": 3264,
      "cache_write_tokens": 0,
      "total_tokens": 3303,
      "reasoning_tokens": 0,
      "cost_total": 0
    },
    {
      "index": 3,
      "model": "berget/zai-org/GLM-5.2",
      "input_tokens": 1567,
      "output_tokens": 5097,
      "cache_read_tokens": 1408,
      "cache_write_tokens": 0,
      "total_tokens": 8072,
      "reasoning_tokens": 0,
      "cost_total": 0
    },
    {
      "index": 4,
      "model": "berget/zai-org/GLM-5.2",
      "input_tokens": 64,
      "output_tokens": 3,
      "cache_read_tokens": 8064,
      "cache_write_tokens": 0,
      "total_tokens": 8131,
      "reasoning_tokens": 0,
      "cost_total": 0
    },
    {
      "index": 5,
      "model": "berget/zai-org/GLM-5.2",
      "input_tokens": 2728,
      "output_tokens": 26,
      "cache_read_tokens": 1536,
      "cache_write_tokens": 0,
      "total_tokens": 4290,
      "reasoning_tokens": 0,
      "cost_total": 0
    },
    {
      "index": 6,
      "model": "berget/zai-org/GLM-5.2",
      "input_tokens": 1225,
      "output_tokens": 12,
      "cache_read_tokens": 4288,
      "cache_write_tokens": 0,
      "total_tokens": 5525,
      "reasoning_tokens": 0,
      "cost_total": 0
    },
    {
      "index": 7,
      "model": "berget/zai-org/GLM-5.2",
      "input_tokens": 34,
      "output_tokens": 577,
      "cache_read_tokens": 5504,
      "cache_write_tokens": 0,
      "total_tokens": 6115,
      "reasoning_tokens": 0,
      "cost_total": 0
    },
    {
      "index": 8,
      "model": "berget/zai-org/GLM-5.2",
      "input_tokens": 352,
      "output_tokens": 20,
      "cache_read_tokens": 6080,
      "cache_write_tokens": 0,
      "total_tokens": 6452,
      "reasoning_tokens": 0,
      "cost_total": 0
    },
    {
      "index": 9,
      "model": "berget/zai-org/GLM-5.2",
      "input_tokens": 0,
      "output_tokens": 0,
      "cache_read_tokens": 0,
      "cache_write_tokens": 0,
      "total_tokens": 0,
      "cost_total": 0
    },
    {
      "index": 10,
      "model": "berget/zai-org/GLM-5.2",
      "input_tokens": 2384,
      "output_tokens": 48,
      "cache_read_tokens": 1984,
      "cache_write_tokens": 0,
      "total_tokens": 4416,
      "reasoning_tokens": 0,
      "cost_total": 0
    },
    {
      "index": 11,
      "model": "berget/zai-org/GLM-5.2",
      "input_tokens": 5104,
      "output_tokens": 1958,
      "cache_read_tokens": 4352,
      "cache_write_tokens": 0,
      "total_tokens": 11414,
      "reasoning_tokens": 0,
      "cost_total": 0
    },
    {
      "index": 12,
      "model": "berget/zai-org/GLM-5.2",
      "input_tokens": 41,
      "output_tokens": 35,
      "cache_read_tokens": 11392,
      "cache_write_tokens": 0,
      "total_tokens": 11468,
      "reasoning_tokens": 0,
      "cost_total": 0
    },
    {
      "index": 13,
      "model": "berget/zai-org/GLM-5.2",
      "input_tokens": 90,
      "output_tokens": 119,
      "cache_read_tokens": 11456,
      "cache_write_tokens": 0,
      "total_tokens": 11665,
      "reasoning_tokens": 0,
      "cost_total": 0
    },
    {
      "index": 14,
      "model": "berget/zai-org/GLM-5.2",
      "input_tokens": 0,
      "output_tokens": 0,
      "cache_read_tokens": 0,
      "cache_write_tokens": 0,
      "total_tokens": 0,
      "cost_total": 0
    }
  ],
  "pi_exit_code": 0,
  "telemetry_source": "pi-json-event-stream",
  "port_reclamation": {
    "preexisting_listener": false,
    "listener_after_pi": false,
    "attempted": false,
    "reclaimed": false,
    "process_ids": [],
    "diagnostic": "Port 3000 remained free after Pi"
  }
}
