{
  "run_id": "2026-08-23T11-31-55-172Z",
  "weighted_score": 111946.4,
  "status": "failed",
  "app_url": "http://localhost:3000",
  "start_command": "npm --prefix 'output/app' run dev",
  "summary": "The harness did not produce a valid report.partial.json file.",
  "implemented_features": [],
  "assumptions": [],
  "tests_run": [],
  "harness_checks": [
    {
      "command": "output/app/node_modules/.bin/vitest run --reporter=json --outputFile=artifacts/runs/2026-08-23T11-31-55-172Z/app-test-results.json --passWithNoTests=false",
      "journey": "The generated app's Vitest report contained at least one completed test and no failed, skipped, or todo tests",
      "result": "failed"
    },
    {
      "command": "npm run build",
      "journey": "The generated app completed a production build",
      "result": "passed"
    },
    {
      "command": "npm run dev",
      "journey": "The generated app started its own HTTP server on port 3000 and shut down cleanly",
      "result": "passed"
    }
  ],
  "model_calls": 28,
  "input_tokens": 24990,
  "output_tokens": 20642,
  "cache_read_tokens": 250304,
  "cache_write_tokens": 0,
  "total_tokens": 295936,
  "reasoning_tokens": 0,
  "cost_total": 0.066274,
  "call_log": [
    {
      "index": 1,
      "model": "berget/zai-org/GLM-5.2",
      "input_tokens": 36,
      "output_tokens": 1696,
      "cache_read_tokens": 1856,
      "cache_write_tokens": 0,
      "total_tokens": 3588,
      "reasoning_tokens": 0,
      "cost_total": 0.003428
    },
    {
      "index": 2,
      "model": "berget/zai-org/GLM-5.2",
      "input_tokens": 1615,
      "output_tokens": 4,
      "cache_read_tokens": 1984,
      "cache_write_tokens": 0,
      "total_tokens": 3603,
      "reasoning_tokens": 0,
      "cost_total": 0.0016229999999999999
    },
    {
      "index": 3,
      "model": "berget/zai-org/GLM-5.2",
      "input_tokens": 1898,
      "output_tokens": 1280,
      "cache_read_tokens": 192,
      "cache_write_tokens": 0,
      "total_tokens": 3370,
      "reasoning_tokens": 0,
      "cost_total": 0.004458
    },
    {
      "index": 4,
      "model": "berget/zai-org/GLM-5.2",
      "input_tokens": 59,
      "output_tokens": 117,
      "cache_read_tokens": 3328,
      "cache_write_tokens": 0,
      "total_tokens": 3504,
      "reasoning_tokens": 0,
      "cost_total": 0.00029299999999999997
    },
    {
      "index": 5,
      "model": "berget/zai-org/GLM-5.2",
      "input_tokens": 1929,
      "output_tokens": 56,
      "cache_read_tokens": 640,
      "cache_write_tokens": 0,
      "total_tokens": 2625,
      "reasoning_tokens": 0,
      "cost_total": 0.002041
    },
    {
      "index": 6,
      "model": "berget/zai-org/GLM-5.2",
      "input_tokens": 1763,
      "output_tokens": 44,
      "cache_read_tokens": 2624,
      "cache_write_tokens": 0,
      "total_tokens": 4431,
      "reasoning_tokens": 0,
      "cost_total": 0.001851
    },
    {
      "index": 7,
      "model": "berget/zai-org/GLM-5.2",
      "input_tokens": 95,
      "output_tokens": 7705,
      "cache_read_tokens": 4416,
      "cache_write_tokens": 0,
      "total_tokens": 12216,
      "reasoning_tokens": 0,
      "cost_total": 0.015505
    },
    {
      "index": 8,
      "model": "berget/zai-org/GLM-5.2",
      "input_tokens": 101,
      "output_tokens": 56,
      "cache_read_tokens": 12160,
      "cache_write_tokens": 0,
      "total_tokens": 12317,
      "reasoning_tokens": 0,
      "cost_total": 0.000213
    },
    {
      "index": 9,
      "model": "berget/zai-org/GLM-5.2",
      "input_tokens": 367,
      "output_tokens": 275,
      "cache_read_tokens": 12288,
      "cache_write_tokens": 0,
      "total_tokens": 12930,
      "reasoning_tokens": 0,
      "cost_total": 0.0009169999999999998
    },
    {
      "index": 10,
      "model": "berget/zai-org/GLM-5.2",
      "input_tokens": 22,
      "output_tokens": 28,
      "cache_read_tokens": 12928,
      "cache_write_tokens": 0,
      "total_tokens": 12978,
      "reasoning_tokens": 0,
      "cost_total": 0.000078
    },
    {
      "index": 11,
      "model": "berget/zai-org/GLM-5.2",
      "input_tokens": 1520,
      "output_tokens": 38,
      "cache_read_tokens": 12928,
      "cache_write_tokens": 0,
      "total_tokens": 14486,
      "reasoning_tokens": 0,
      "cost_total": 0.0015959999999999998
    },
    {
      "index": 12,
      "model": "berget/zai-org/GLM-5.2",
      "input_tokens": 1887,
      "output_tokens": 53,
      "cache_read_tokens": 14464,
      "cache_write_tokens": 0,
      "total_tokens": 16404,
      "reasoning_tokens": 0,
      "cost_total": 0.001993
    },
    {
      "index": 13,
      "model": "berget/zai-org/GLM-5.2",
      "input_tokens": 96,
      "output_tokens": 3486,
      "cache_read_tokens": 16384,
      "cache_write_tokens": 0,
      "total_tokens": 19966,
      "reasoning_tokens": 0,
      "cost_total": 0.007068
    },
    {
      "index": 14,
      "model": "berget/zai-org/GLM-5.2",
      "input_tokens": 78,
      "output_tokens": 37,
      "cache_read_tokens": 19904,
      "cache_write_tokens": 0,
      "total_tokens": 20019,
      "reasoning_tokens": 0,
      "cost_total": 0.000152
    },
    {
      "index": 15,
      "model": "berget/zai-org/GLM-5.2",
      "input_tokens": 0,
      "output_tokens": 0,
      "cache_read_tokens": 0,
      "cache_write_tokens": 0,
      "total_tokens": 0,
      "cost_total": 0
    },
    {
      "index": 16,
      "model": "berget/zai-org/GLM-5.2",
      "input_tokens": 2651,
      "output_tokens": 104,
      "cache_read_tokens": 576,
      "cache_write_tokens": 0,
      "total_tokens": 3331,
      "reasoning_tokens": 0,
      "cost_total": 0.0028589999999999996
    },
    {
      "index": 17,
      "model": "berget/zai-org/GLM-5.2",
      "input_tokens": 8782,
      "output_tokens": 110,
      "cache_read_tokens": 3328,
      "cache_write_tokens": 0,
      "total_tokens": 12220,
      "reasoning_tokens": 0,
      "cost_total": 0.009002
    },
    {
      "index": 18,
      "model": "berget/zai-org/GLM-5.2",
      "input_tokens": 533,
      "output_tokens": 62,
      "cache_read_tokens": 12160,
      "cache_write_tokens": 0,
      "total_tokens": 12755,
      "reasoning_tokens": 0,
      "cost_total": 0.0006569999999999999
    },
    {
      "index": 19,
      "model": "berget/zai-org/GLM-5.2",
      "input_tokens": 135,
      "output_tokens": 4098,
      "cache_read_tokens": 12736,
      "cache_write_tokens": 0,
      "total_tokens": 16969,
      "reasoning_tokens": 0,
      "cost_total": 0.008331
    },
    {
      "index": 20,
      "model": "berget/zai-org/GLM-5.2",
      "input_tokens": 27,
      "output_tokens": 55,
      "cache_read_tokens": 16960,
      "cache_write_tokens": 0,
      "total_tokens": 17042,
      "reasoning_tokens": 0,
      "cost_total": 0.000137
    },
    {
      "index": 21,
      "model": "berget/zai-org/GLM-5.2",
      "input_tokens": 47,
      "output_tokens": 115,
      "cache_read_tokens": 17024,
      "cache_write_tokens": 0,
      "total_tokens": 17186,
      "reasoning_tokens": 0,
      "cost_total": 0.00027699999999999996
    },
    {
      "index": 22,
      "model": "berget/zai-org/GLM-5.2",
      "input_tokens": 54,
      "output_tokens": 124,
      "cache_read_tokens": 17152,
      "cache_write_tokens": 0,
      "total_tokens": 17330,
      "reasoning_tokens": 0,
      "cost_total": 0.000302
    },
    {
      "index": 23,
      "model": "berget/zai-org/GLM-5.2",
      "input_tokens": 516,
      "output_tokens": 446,
      "cache_read_tokens": 17280,
      "cache_write_tokens": 0,
      "total_tokens": 18242,
      "reasoning_tokens": 0,
      "cost_total": 0.001408
    },
    {
      "index": 24,
      "model": "berget/zai-org/GLM-5.2",
      "input_tokens": 22,
      "output_tokens": 28,
      "cache_read_tokens": 18240,
      "cache_write_tokens": 0,
      "total_tokens": 18290,
      "reasoning_tokens": 0,
      "cost_total": 0.000078
    },
    {
      "index": 25,
      "model": "berget/zai-org/GLM-5.2",
      "input_tokens": 550,
      "output_tokens": 572,
      "cache_read_tokens": 18240,
      "cache_write_tokens": 0,
      "total_tokens": 19362,
      "reasoning_tokens": 0,
      "cost_total": 0.001694
    },
    {
      "index": 26,
      "model": "berget/zai-org/GLM-5.2",
      "input_tokens": 0,
      "output_tokens": 0,
      "cache_read_tokens": 0,
      "cache_write_tokens": 0,
      "total_tokens": 0,
      "cost_total": 0
    },
    {
      "index": 27,
      "model": "berget/zai-org/GLM-5.2",
      "input_tokens": 10,
      "output_tokens": 5,
      "cache_read_tokens": 256,
      "cache_write_tokens": 0,
      "total_tokens": 271,
      "reasoning_tokens": 0,
      "cost_total": 0.000019999999999999998
    },
    {
      "index": 28,
      "model": "berget/zai-org/GLM-5.2",
      "input_tokens": 197,
      "output_tokens": 48,
      "cache_read_tokens": 256,
      "cache_write_tokens": 0,
      "total_tokens": 501,
      "reasoning_tokens": 0,
      "cost_total": 0.00029299999999999997
    }
  ],
  "pi_exit_code": 0,
  "telemetry_source": "pi-json-event-stream",
  "port_reclamation": {
    "preexisting_listener": false,
    "listener_after_pi": false,
    "attempted": false,
    "reclaimed": false,
    "process_ids": [],
    "diagnostic": "Port 3000 remained free after Pi"
  }
}
